{
  "schema_version": 1,
  "captured_at_unix_seconds": 1784493714,
  "host": {
    "os": "windows",
    "architecture": "x86_64"
  },
  "codex": {
    "version": "codex-cli 0.144.5",
    "auth_lane": "chatgpt",
    "authenticated": true,
    "configured_model": "gpt-5.6-sol",
    "config": {
      "location": "default Codex config",
      "present": true,
      "model_context_window": null,
      "model_auto_compact_token_limit": null,
      "model_catalog_json_configured": false,
      "profile_model_override_count": 0
    },
    "runtime_features": {
      "hooks": {
        "available": true,
        "stage": "stable",
        "enabled": true
      },
      "plugins": {
        "available": true,
        "stage": "stable",
        "enabled": true
      },
      "plugin_command_present": true,
      "mcp_command_present": true
    }
  },
  "catalogs": {
    "bundled": {
      "normalized_sha256": "eac5d88049773fc599b5581f54c9f1ff22381401b7ea4c935994556afd0e7d2e",
      "model_count": 8,
      "slug": "gpt-5.6-sol",
      "context_window": 372000,
      "max_context_window": 372000,
      "effective_context_window_percent": 95,
      "effective_budget": 353400,
      "auto_compact_token_limit": null,
      "use_responses_lite": true
    },
    "resolved": {
      "normalized_sha256": "a678f0497f84fe926476bc2e0f8f760c6a8fd8156de6c690e43c2fe245207b9a",
      "model_count": 8,
      "slug": "gpt-5.6-sol",
      "context_window": 272000,
      "max_context_window": 272000,
      "effective_context_window_percent": 95,
      "effective_budget": 258400,
      "auto_compact_token_limit": null,
      "use_responses_lite": true
    }
  },
  "official_sol_limits": {
    "slug": "gpt-5.6-sol",
    "total_context_window": 1050000,
    "max_input": 922000,
    "max_output": 128000
  },
  "comparison": {
    "bundled_total_shortfall": 678000,
    "resolved_total_shortfall": 778000,
    "resolved_effective_shortfall_from_one_million": 741600
  },
  "compliance": {
    "exact_sol_configured": true,
    "resolved_catalog_is_exact_sol": true,
    "resolved_catalog_has_one_million_internal_budget": false,
    "native_one_million_gate_ready": false
  },
  "sources": [
    {
      "subject": "GPT-5.6 Sol model limits",
      "url": "https://developers.openai.com/api/docs/models/gpt-5.6-sol"
    },
    {
      "subject": "Codex configuration reference",
      "url": "https://learn.chatgpt.com/docs/config-file/config-reference"
    },
    {
      "subject": "Codex hooks",
      "url": "https://learn.chatgpt.com/docs/hooks"
    },
    {
      "subject": "Codex plugins",
      "url": "https://learn.chatgpt.com/docs/build-plugins"
    },
    {
      "subject": "Open-source Codex model catalog",
      "url": "https://github.com/openai/codex/blob/main/codex-rs/models-manager/models.json"
    }
  ],
  "sanitization": {
    "arbitrary_config_keys_omitted": true,
    "credentials_omitted": true,
    "model_instructions_omitted": true,
    "model_request_sent": false
  }
}
